{
  "schemaVersion": "1.0",
  "workspaceId": "sample-workspace",
  "updatedAt": "2026-01-01T01:00:00Z",
  "decisions": [
    {
      "id": "DEC-002",
      "decidedAt": "2026-01-01T01:00:00Z",
      "topic": "회원가입 전화번호 없이 진행 가능 여부",
      "question": "회원가입 화면에서 전화번호를 안 넣어도 가입이 되나요?",
      "recommendation": "현재 동작을 유지하는 관찰안을 제안하며 잔여 위험과 로그 영향을 함께 확인합니다",
      "decidedBy": "baseline-default",
      "decision": "값 없음(Optional)으로 처리. 검증 오류로 바꾸지 않음.",
      "scope": "NULL_RETURN_STD 중 UserService.getPhone 호출 경로 12건",
      "rationale": "담당자가 정책을 확정하지 못했지만 제시한 관찰 방법과 변경 범위를 선택한 합성 예시입니다. 필수값 전환은 추가 근거가 필요합니다.",
      "evidence": [
        "users.phone nullable, 실제 null 3,200행 (12%)",
        "signup.html:41 required 없음",
        "UserValidator에 phone 검증 없음"
      ],
      "checkers": ["NULL_RETURN_STD"],
      "findingIds": ["SAMPLE-001"],
      "answerableBy": "developer",
      "exceptions": "",
      "observation": "SmsSender.send:88 phone==null 경로에 WARN 로그 추가 (비밀값 없음)",
      "reviewTrigger": "담당자가 2주 후 로그 수집 정상 여부·표본·업무 조건을 확인하고 재검토합니다. 로그 없음만으로 필수값을 확정하지 않습니다."
    },
    {
      "id": "DEC-001",
      "decidedAt": "2026-01-01T00:30:00Z",
      "topic": "비밀번호 해시 형식 변경 가능 여부",
      "question": "이 해시값을 우리 말고 읽는 시스템이 있나요? 예전 데이터도 같은 형식인가요?",
      "recommendation": "명세와 양쪽 사용처가 확인되기 전에는 형식을 변경하지 않음",
      "decidedBy": "user",
      "decision": "형식 유지. SSO 연동이 같은 해시를 검증하므로 변경 금지.",
      "scope": "WEAK_HASH 체커 전체",
      "rationale": "사용자가 SSO 연동 담당에게 확인함. 형식을 바꾸면 SSO 로그인이 전부 실패.",
      "evidence": ["sso-integration.md §3.2", "AuthProvider.verify:120"],
      "checkers": ["WEAK_HASH"],
      "findingIds": [],
      "answerableBy": "integration-owner",
      "exceptions": "",
      "observation": "",
      "reviewTrigger": "SSO 연동 명세가 개정되면"
    }
  ]
}
